 products,submitted,11031,DELUXE Brilliant Lipgloss,./layout/uploads/products/imgdeluxe-brilliant-lipgloss.jpg,LIPGLOSS met brilliant effect,Vollere vochtige glanzende lippen - geven je UNIEKE lippen - lichte textuur met reflecterende glitterpartikels - zoet smaak met verleidingspotentieel - met verzorgde werkstoffen,lady,lips,14.90,lipstick
 products,submitted,11002,CARBON Black Eyestyler,./layout/uploads/products/imgdeluxe-carbon-black-eyestyler.jpg,Zwarte ogenvormer ,Het diepe en intensiefste zwart-eenvoudige één-hands applicatie door flexibele vilttop - voor juiste dunne lijnen of de bredere katoptiek - optimale bewaring,lady,face,15.90,parfum
 products,submitted,11063,Fast Wrinkle-Filler,./layout/uploads/products/imgdeluxe-fast-wrinkel-filler.jpg,ONMIDDELIJKE rimpelvuller,Vult rimpels en eneffenheden-kleine littekens van buitenaf op - lange houdende textuur voor een gelijkmatige teint - met Pentanol en Q10 - onder de make-up aanbrengen en kort laten opdrogen,lady,face,19.90,parfum
 products,submitted,11066,Glamorous Blush,./layout/uploads/products/imgdeluxe-glamorous-blush.jpg,Glamoureuze Rouge,Adembenemend kleurenspel voor de wangen - 2-kleurig voor talrijke kleurvarianten - fijn zachte textuur voor lange houdbaarheid - te verktijgen in Rubin Rush  Gold Fever,lady,face,28.90,parfum
 products,submitted,11068,Hollywood Powder,./layout/uploads/products/imgdeluxe-hollywood-powder.jpg,Het geheime Multicolour,Ideaal voor iedere dag en iedere huidskleur - geel verminderd scheduw en onregelmatigheden - nature ondersteunt de natuurlijke huidskleur en vermindert pigmentverschillen - groen vermindert rode adertjes of pigmenten op de huid - voor een perfecte vlekkeloze gelijkmatige teint - STERREN GEBRUIKEN DEZE IEDER DAG,lady,face,34.50,parfum
 products,submitted,11064,Hollywood enkel,./layout/uploads/products/imgdeluxe-hollywood-powder_002.jpg,Enkel geel - lila voor Profs,Dezelfde kwaliteit die de sterren ieder dag dragen - het gele(banana)vermindert oneffenheden en schaduw-zorgt voor een oplichtende frisse teint - het geheime lila voor een stralende teint-een grijs uitziende huid wordt opnieuw levendig - ideaal voor schijnwerpers en kunstlicht,lady,face,31.90,parfum
 products,submitted,11007,DELUXE Lash booster,./layout/uploads/products/imgdeluxe-lash-booster.jpg,Wimpers Volumegever,Basis voor ieder mascara - zorgt voor een ongelooflijke wimpervolume - verlengt de houdbaarheid van mascara - unieke borstel met parallelvezels voor een ideale applicatie - aanbrengen en even wachten-daarna mascara aanbrengen,lady,face,17.50,parfum
 products,submitted,11032,Deluxe Longwear Lipliner,./layout/uploads/products/imgdeluxe-longwear-lipliner.jpg,Langhoudende lippencontourenstift,Ideaal om de lippen te kleuren te onderlijnen of gelijk te maken - beschermt kleuren tegen uitlopen - unieke zachtheid met etherische oliën - voor glanzende en langhoudende kleurresultaten - te verkrijgen in  Nude Line  Rosy Line  Red Line  Pink Line,lady,face,12.50,lipstick
 products,submitted,11067,Luminous Primer,./layout/uploads/products/imgdeluxe-luminous-primer.jpg,Oplichtende basis,Basis voor elke make-up - zorgt voor ongelooflijke gelijkmatige zachte stralende teint - actieve whitening gie ouderdomsvlekken en verschil in pigmenteringen oplicht - op de gereinigde huid voor de make-up aanbrengen - DOE HET PROFESSIONEEL,lady,face,28.90,parfum
 products,submitted,consulent,DELUXE Make-up set,./layout/uploads/products/imgdeluxe-make-up-set.jpg,Make it magic,Welke look en welke wereld fasineert je vandaag ? Verander u met de Hollywood passende look-set - Vraag ernaar op het nummer 0494/035452 je zal verstomd staan welke voordelen je doet,lady,face,vraag ernaar,parfum
 products,submitted,11001,Deluxe Metallic Eyeliner,./layout/uploads/products/imgdeluxe-metallic-eyeliner.jpg,Metallic oogcontourenstift,Intensieve adembenemende metallicglans - crèmige textuur voor een vloeiende eenvoudige applicatie - met geïntegreerde vervager voor het vervagen van overgangen - te verkrijgen in Toxis Green  Velvet Violet  Moonlight Silver,lady,lips,13.90,lipstick
 products,submitted,11030,Seduction Lipstick DELUXE,./layout/uploads/products/imgdeluxe-seduction-lipstick.jpg,Lippensiftverleidingen,Elegante oplichtende look-unieke kleurenresultaten uit matte en oplichtende pigmenten - de crèmige dekkende structuur hydrateert en maakt je lippen zijde-zacht - met kusecht parfum en kusechte smaak - te verkrijgen in Nude Seduction  Rosy Love  Red Sin  Pink Excess   ,lady,lips,22.90,parfum
 products,submitted,consulent,Aloë Vera Sets,./layout/uploads/products/img380x210_av-care_03.jpg,DEZE REEKS IN AANBIEDDING,Deze aanbiedding bestaat uit  Concentrate 90%  Thermo lotion 45% Propolis 79% Lippenbalsem 40% Huidcrème 35%  lichaamslotion 69%  haar&#38lichaamsshampoo 35%  Emergency Spray 83%  Deze set in huis en je mag alle andere dingen in de vuilnisemmer gooien want hier heb je Health &#38 Beauty en EHBO volledig in één set - Vraag ernaar op 0494/035452 voor deze promotie,neuter,body,in speciale aanbiedding,creme
 products,submitted,1970,Iris Berben  care set,./layout/uploads/products/img380x210_berben_05.jpg,Ideaal voor jezelf of cadeau,Bevat dag &#38 nachtcrème 50ml  serum 30ml reinigingsmelk 200ml gelaatswater 200ml  En een cosmeticatas ter waarde van 15.95 GRATIS  niet voor 184.15 MAAR voor 164.90,lady,body,164.90,creme
